景点,comments,score
天沐温泉度假村,第一次来泡温泉没有经验，女宾的小董和小金贴心的给我介绍注意事项。温泉区景色宜人，工作人员的服务都很周到！特色火锅池很有创意呢。二楼还有休息区和影剧院！,0.9999949835950058
天沐温泉度假村,环境非常好，里面服务员很热情，在里面感觉很大，当时没有找到卫生间，服务员小洲，小晗及时给予指引，引导。很好的体验感，很不错的温泉，值得大家去体验一下。,0.9999763435226645
天沐温泉度假村,这个季节过来泡温泉非常适合，，泡完非常舒服，室外环境好，池子多，水池干净，在这还能看到火锅池，太棒了。楼上的小丁和小钟服务很棒，给我们介绍小吃和简餐！,0.9607410069361974
天沐温泉度假村,推荐大家来泡温泉，池子多水温好，还有搓澡服务员提前预约帮安排好泡搓两不误时间，楼上还有小吃坊非常方便，室内小姜小魏服务安排到位给个赞 【景色】 【性价比】,0.9114477664821142
天沐温泉度假村,和朋友一起来玩的，服务特别的好很热情，一进更衣室小姜就帮我们开柜子拿拖鞋，毛巾忘记拿了小魏同志迅速的帮我们拿过来帮我披上。玩过后感觉很好，下车还要来。,0.6957733824929342
天沐温泉度假村,休息来泡温泉的，温泉水泡的很舒服，体验非常好，印象最深的还是服务好，特别是小孙小魏两人一进更衣室就很热情微笑打招呼，帮我开柜子拿拖鞋，很棒的一次体验。,0.9284110071197659
天沐温泉度假村,温泉池子很多，各种各样的中草药都有，环境特别棒，最主要还是这边服务非常贴心，给小魏小孙两人点个赞，服务特别周到。下次还要来。 【景色】 【趣味】 【性价比】,0.9999999881946103
天沐温泉度假村,带老妈来玩，环境很好啊，中午进场人也不多，小池子很多个，纱幔环绕，泡的很舒服。休息厅也很大，沙发都能自动调节，配单独小电视很人性。,0.9713549530507903
天沐温泉度假村,周末过来泡温泉，今天过来泡温泉的人不少，室外温泉推荐麻将池，室内一楼有免费的量血压，二楼有免费的银耳莲子汤和水果，服务也特别的好，尤其是小丁和小钟。,0.3394924257404498
天沐温泉度假村,温泉之旅值得拥有，冬季泡温泉实在是太舒服了。这里环境优美。还有非常香的美容池。服务也超棒，特别是室外的小谢和小涵他们带我们去了牛奶池，为他们俩点赞！,0.9941789848359959
天沐温泉度假村,今天又来泡温泉了，虽然天气比较冷，但是泡个温泉还是蛮舒服的。室内的小丁和小姜服务很热情，给我推荐了好看的电影，二楼的影剧院效果还是很好的，值得推荐。,0.999270444993495
天沐温泉度假村,瘦西湖温泉果然不错，环境很好【景色】设备齐全，从浴室洗完澡出来还有甩干机拖水很棒，服务人员小孙小魏服务很好及时的拿塑料袋和毛巾给我，体验后感觉不错。,0.9981458777996721
天沐温泉度假村,酒店位置非常好，服务人员非常热情，感谢为我办入住的夏敏经理；胡杰同志为我讲解旅游景点。温泉也非常好，下次再来,0.5919241056367648
天沐温泉度假村,经朋友介绍来这里游玩，这里环境优美，服务也很热情。特别是室外的小谢和小涵他们主动为我们更换了毛巾。还为我们指路，介绍了很多有意思的泡池，感谢他们。,0.9853429427390542
天沐温泉度假村,温泉度假村环境很好，温泉也很舒服，泡在身上滑滑的感觉，室内服务也很不错，更衣室小魏和小孙帮我找香烟，很感谢他们，虽然不值几个钱服务还是非常温心的。,0.9118316624383077
天沐温泉度假村,温泉非常好，环境非常的优美，外面温泉池很多，基本都是室外的，冬季在外面泡温泉很舒服，小谢，小含服务很棒，推荐地热带很舒服，促进血液循环，对身体好。,0.6036171427246227
天沐温泉度假村,第一次来这里泡温泉，这里风景真好，环境好的没话说。室外的小谢和小涵人非常好，给我们介绍了非常好玩的池子，二楼还有免费的果盘。非常好。下次一定再来。,0.28265711384131786
天沐温泉度假村,温泉泡的舒服室内室外服务好，泳裤忘了服务员主动帮我们找到，还提供一次性塑料袋让我们方便拿湿的泳裤，很好的环境很好的人给室内小魏、小孙点赞 【性价比】,0.9999919862809437
天沐温泉度假村,周末人好多呀，池子里面全是脑袋的场景十分有意思。环境优美，服务也很热情。室外的小谢和小涵服务很棒。天冷给我们拿来干浴巾，还为我们提供了免费的姜茶。,0.9811711659581163
天沐温泉度假村,属于天然偏硅酸锂的医疗型温泉，里面有非常多的小池子可泡。我很喜欢一大早，早早起来，赶个早来泡第一泡，哈哈。,0.04833177959360535
天沐温泉度假村,瘦西湖温泉度假村来了好几次乐，这里环境非常好。服务也非常好。还有免费的果然可以享用。室外的小谢和小涵人很好，为我们介绍了很多好玩的地方。谢谢他们,0.997303476330984
天沐温泉度假村,周末过来沐浴温泉非常的棒，人员还挺多的，里面工作人服务很热情，小谢，小含服务挺好的在外面找不到毛巾了，他们及时给我寻找更换，服务到位，非常不错。,0.9821850033040835
天沐温泉度假村,正好放假和朋友一起过来泡个温泉，女宾的小金和小王服务周到，对我们很热情，还帮我们找柜子，这边的温泉环境也不错，有很多池子，池子温度合适，很舒服。,0.9999407300278649
天沐温泉度假村,整体设施很齐全，服务人员随处可见态度很好，晚上来的人也不少，池子多就不显得人多，泡完去旁边的景观湖散散步感觉很好，室内小姜和小魏服务好，五星好评,0.9998048058483134
天沐温泉度假村,上周来泡的温泉，环境很不错，虽然天气比较冷，但是很舒服，二楼休息区很大，还有儿童乐园，小丁和小钟非常热情，给我拿毛巾盖腿，送了红枣水和水果，很赞,0.9747920392438784
天沐温泉度假村,晚上来泡温泉好美啊，感觉像在仙境一样。就是太冷了，水温十分舒适。室外的两个帅哥小谢和小涵为我们提供了免费的姜茶还还我们拿来了毛巾，十分感谢他们。,0.23048626038796893
天沐温泉度假村,陪老妈来的，池子很多但是很小，人也不多，很热很舒服。休息区域很大。唯一不足是泡汤时毛巾没有地方换干的，茶水也只有白水，没有像其他一样的红茶或姜茶,0.6643289345607198
天沐温泉度假村,去过很多家温泉，还是觉得这家温泉服务很好，女宾的小金和小钟两个人服务很好，介绍了里面很多项目，还跟我们讲了适合泡的温泉池，特别喜欢里面润白汤。,0.9613500798600636
天沐温泉度假村,下着小雨，泡温泉很有味道，小谢，小晗推荐我们特色温泉池，有室内泡泡温泉池，麻将池，很有特色，服务很不错，很不错的一个体验。值得大家去感受一下。,0.9868878885666151
天沐温泉度假村,想泡温泉，看到网上有活动，非常的划算，来的很值得，推荐大家来泡温泉。前台有服务员赠送苹果，楼上的小丁和小钟服务很棒，给他们赞赞，圣诞快乐！！！,0.9996412785459208
天沐温泉度假村,周末来泡温泉，人不多，很舒服……池子种类也比较多，按摩池更舒服，小鱼池虽然要钱，但是38元还是可以接受的，比其他不用花钱的小鱼池要干净，关键要花钱，泡的人不多，小鱼都涌过来，特别舒服,0.9593975819496362
天沐温泉度假村,在一个跟公园里面，环境真心的不错！可以打前台电话叫车来接到大厅，室内环境舒适！院里的温泉也很好，卫生间较大，更衣室也很规整！麻将室落地窗，比较舒服！下次还会再来！希望价格便宜点更好！,0.8591444647129864
天沐温泉度假村,温泉水的温度舒服干净，二楼有免费领取的水果一份，茶水有免费的，停车场很大，过来消费都是免费停车。里面服务员服务热情周到，小谢，小晗服务到位。,0.9984280858252594
天沐温泉度假村,这里风景不错，非常好。服务也是一级棒。有很多有特色的池子，像盐池，牛奶和火锅池非常好玩。非常感谢室外的小谢和小涵为我们送来干毛巾。感谢他们。,0.9975200084726025
天沐温泉度假村,和家人一起来玩的，设备很齐全，最有亮点的还有这边服务，我们到更衣室孙浩和小魏就热情打招呼，给我们找柜子，帮我们看孩子。整体感觉很好还会再来。,0.997222689139437
天沐温泉度假村,和男朋友一起来泡温泉，环境很好，服务也很棒，特别是女宾的小金和小钟，服务意识特别好，给我讲了温泉知识，二楼还有水果可以吃。玩的很开心哦！推荐,0.9994122332948088
天沐温泉度假村,环境不错，水也好，都有药包在里面，最重要的服务特别棒特别是室内，小魏小姜很热情，因为脚比较大还专门帮我找了大的拖鞋。很好很好很好，强烈推荐。,0.9999787619103495
天沐温泉度假村,温泉??环境非常好，是室外的温泉，池子很多很不错，室内的服务很好，因为温泉在外面比较冷更衣室小孙小姜拿了两条毛巾给我提醒我保暖。整体体验很好,0.2118206889595291
天沐温泉度假村,温泉环境很好，温泉水里面还要草药很舒服，最重要是服务人员特别的热情，特别是室内小孙小姜两人，帮我开柜子拿毛巾什么的都很及时。很好的一次体验，,0.6933889019715074
天沐温泉度假村,泡温泉很不错，环境好，温泉水好，里面的美女帅哥也多，室内，室外空间都很大。温泉水温很不错，服务员小晗，小谢很不错，给我们介绍各种美食，饮品，,0.9998381459203791
天沐温泉度假村,第一次和闺蜜来瘦西湖温泉度假村玩，原本是来扬州考试。顺便来泡温泉。这里风景十分优美，服务也很好。特别是室外的两个帅哥小谢和小涵。为他们点赞。,0.9999301001356601
天沐温泉度假村,前台的小董很热心的为我们推荐了优惠票，还有小苗仙女很好看也很耐心的帮我们操作登记，今天的天气非常好，里面的池子很多，温泉水也很干净。玩的很开心！下次还会再来的。,0.9635522298722684
天沐温泉度假村,千万别搓背！千万别搓背！千万别搓背！温泉环境相当不错，而且绝对是名副其实的温泉，池子也多，记住一点，千万别搓背，服务极次，城里边20搓一个背的师傅也比这用心，根本就体现不出扬州的特色！而且你就算跟前台反应了，前台也根本不会搭理你！再次强调，千万别搓背！,1.609823385706477e-13
天沐温泉度假村,度假村的别墅房可以住四人，两卧两卫，一个客厅。客厅有电动麻将台，需要收费使用。别墅房有独立私汤，可以提前两小时左右通知客房管家放水。温泉水可以放调好温度的和原汤两种，前者约40度左右可以直接泡，后者将近60度，需要约三小时左右冷却。我们去的时候是一月底，室外温度5度左右，冷却了3小时左右还有差不多45度，经过一晚上，水温还是30度左右，所以要泡私汤的话还是要算好时间的。别墅房的温泉只能每天23:00前放水一次，并可免费加温一次，性价比挺高，适合带老人小孩，私密性高。入住度假村也可以享受公共温泉优惠价，买一次票可以在入住期间无限次使用，性价比不错。住在别墅房的出行可以通过前台预约礼宾车接送，一般5分钟左右会到达，很方便。酒店出门就是瘦西湖，紧临度假村旁的扬州宴是家黑珍珠二星的酒楼，可以去尝尝。早餐一般，主要是人多的话加东西有些慢了。,2.9785818256300445e-09
天沐温泉度假村,第一次来这里泡温泉，感觉很不错。天气好，环境特别好，露天的池子，可以晒到阳光，很舒服。而且这里池子也很多，各种养身池，美容养颜池，这次没泡完，下次一定还要再来体验。这里的服务员态度也是非常的热情，给露天张悦和黄慧敏点赞！强烈推荐这家酒店哦！,0.9373707561970213
天沐温泉度假村,暑假带小朋友过来，度假村无论硬件还是软件都非常不错，这里还给每间房间配备了专属管家，张莉和柏建春两位管家细致周到的服务，必须要赞扬！一般酒店冰箱里的饮料是要收费的，但张管家特地到我们房间解释了他们度假村冰箱里的饮料是免费的，还为小朋友带来了零食；张莉是土生土长的扬州本地人，她根据我们瘦西湖的游玩时间推荐了最佳线路，并暖心的写了下来，怕我们混淆。有机会来扬州必入住瘦西湖温泉度假村，并会积极推荐身边来扬州游玩的朋友入住此酒店！,0.9999616270662528
天沐温泉度假村,温泉酒店，环境非常完美，温泉水很青，水温很舒服，工作人员服务很棒，热情，做事情很周到，帮助我们提供干毛巾，表扬小含，小谢，服务周到，很棒。,0.9999933297326521
天沐温泉度假村,这家度假村在扬州的位置非常优越，就要瘦西湖对面，位置非常的好找，环境不错，服务也不错，二楼的小丁和小钟服务态度好，帮我们指引带到休息大厅。,0.9999736839486638
天沐温泉度假村,服务不错，第一次来扬州泡温泉，感谢室内的小孙和小姜热情的服务，给我介绍了很多扬州周边的游玩项目。室外区域也很大，有很多温泉池，玩的很高兴。,0.6284283493847624
天沐温泉度假村,瘦西湖温泉适合带着朋友、家人一起来泡温泉的地方。环境好，地方大，休息厅的地方安静，二楼的小丁和小钟待客热情，服务周到，楼上的红枣茶不错哦！,0.999556586990452
天沐温泉度假村,浴室李方林***主动热情，帮我挂衣服，调换拖鞋，提醒保管物品，好***值得推荐，也感谢小席介绍泡温泉的好处，女性的特色温泉池??，还有汗蒸房是免费的，推荐给大家。,0.0021293581376827797
天沐温泉度假村,整体环境不错，在瘦西湖的东门，不要找错了门，工作人员态度都不错，扫手牌送水果！,0.9988979321459679
天沐温泉度假村,周末带家里人来泡温泉，体验感超值。冬天水温泡起来十分舒服。服务员也十分热情有礼貌，特别是室外的小谢和小涵。还为我们介绍了牛奶泡池。十分棒,0.9963203275525084
天沐温泉度假村,今天打电话去预约国庆的温泉门票，刚好是上次小席接的电话，推荐了好多国庆特价票，跟周边的马戏团活动，服务是一如既往的好，也谢谢服务员小曼热情服务，推荐给大家。,0.38462467393666777
天沐温泉度假村,温泉环境很好，有很多的池子，洗完澡还有脱水机脱水蛮不错的，最重要的服务好，室内小魏小孙很热情，又是找柜子又是拿拖鞋 很感谢，下次还要来。,0.7756034436475675
天沐温泉度假村,环境很不错，温泉池种类非常多，今天周末，来的人挺多的，里面工作人员服务很热情，感谢小谢，小涵给我们加水温，非常不错的感觉。赞赞赞。。。,0.9999978718517695
天沐温泉度假村,很不错的一次体验，位置好停车特别方便，服务也很不错，室内小魏小孙特别的热情，又是帮我拿毛巾拿袋子的，很周到。 【景色】 【趣味】 【性价比】,0.9999994538453795
天沐温泉度假村,来泡个温泉，泡的很舒服，这里服务非常好。二楼还有休息的地方，室内的小姜、小孙服务不错，从楼上一直送我到了更衣室，带我开柜子，服务很棒。,0.3466702814142175
天沐温泉度假村,和朋友一起来泡温泉，女宾的小董和小猴热心周到的帮我开开柜子，并且还主动的给我拿开客服，赞。今天人不是很多，水也很干净，推荐大家来玩呀！,0.9962845602324985
天沐温泉度假村,温泉度假村泡的温泉水很舒服，水池多而且干净，在瘦西湖对面，装饰很棒，有圣诞节的气息，景色优美，二楼的小丁和小陈服务很好，下次带朋友来。,0.9999854482343092
天沐温泉度假村,温泉水非常好，还有很多中草药温泉池，就是冬天泡有点冷到池子里还好，很舒服。室内服务很热情特别是更衣室小孙和小巍服务很及时。下次还要来！,0.5650305620585301
天沐温泉度假村,和家里老人一起来泡温泉，今天周五，泳池的水很干净，听说是昨天刚换的水，今天来对了，前台的两位小赵给我们推荐了合适的票，和合适的温泉池以及泡汤过程。二楼还可以吃饭，休息，非常棒！下次介绍更多人来。,0.7287786157898984
天沐温泉度假村,环境不错，挺适合很喜欢 特别适合带小孩子来玩。拍照片也特别好看， 服务员小钟小谭服务非常好。 下次还会和家人一起过来。,0.9995549681235444
天沐温泉度假村,环境不错，就在瘦西湖旁边，地理位置非常好，停车场很大免费停车，温泉种类很多，里面的服务员很热情，小谢，小含服务挺好，下次有时间再来。,0.9999777149154698
天沐温泉度假村,带着朋友过来泡温泉，选的这家非常不错，位置好找，环境又好，池子的温度有高有低，总有适合自己的，服务人员小丁和小钟服务很好，点赞！！！,0.9033119610395243
天沐温泉度假村,这天在池子里泡温泉非常舒服，环境好，温泉池子多，池子分室内和室外，楼上的服务人员小丁和小钟服务很棒，给他们点赞，楼上的技师技术不错。,0.11255836423079346
天沐温泉度假村,这里的温泉很舒适，泡完温泉在二楼休息，印象深刻的是小丁和小钟，非常热情，主动帮我连接手机无线网，还送了银耳莲子羹给我，下次还要再来。,0.6916368941592602
天沐温泉度假村,瘦西湖已经是第二次来游玩了，第一次带女儿，这次是带着几个家庭，十几人一起来。虽然天很热，但是小朋友玩得都很开心。总体上我觉得瘦西湖比西湖更小巧精致，体现出了江南文化的精髓。,0.9999999999606299
天沐温泉度假村,环境很好，很适合和朋友一起去，有多种不同种类的池子，泡过之后还可以去吃个自助餐是个不错的选择,0.9973594450806376
天沐温泉度假村,就那样吧，温泉池并不多，水果仅一份，娱乐体验一般般,0.36133134084562635
天沐温泉度假村,和朋友来泡温泉，这里简直太棒了。室外的小谢和小涵为我们送来免费的姜茶，还带我们去了非常有意思的火锅池。感谢他们。天然温泉值得推荐。,0.9565427318136637
天沐温泉度假村,周末过来泡温泉，人非常的多，室内室外都有很多小吃，果汁也非常好喝，二楼的小钟和小丁服务好，讲解好，教我怎么使用三楼的跑步机，感谢！,0.9840323101644779
天沐温泉度假村,玩过后特别满意景色美丽，温泉池子很多，每个服务员的服务也好，特别是男汤孙浩和小魏，我有什么需要都特别快满足我。强烈推荐游玩！！！！,0.9994894429980541
天沐温泉度假村,很高兴能带家人来这里玩。这里的服务员非常热情。二楼的儿童乐园也非常适合小孩玩。室外的小谢和小涵人很好为我们送来干净的毛巾谢谢他们,0.805144712904123
天沐温泉度假村,趁着周末天气好，驱车100多公里，带全家来这里享受一下。环境不错，前台接待很热情，服务员态度很好，黄韵含帅哥很热情，下次还会来。,0.9928246522690307
天沐温泉度假村,很赞，本以为室外会很冷，结果泡温泉后出来完全没问题，池子种类很多，有些装饰得特有感觉。这个价钱泡天然温泉很值哦！泡完休息区待一下，有一份免费水果提供，再做个按摩，舒服！,0.7694256276357612
天沐温泉度假村,这里的服务一级棒，环境也是没话说。还有很多好玩的池子。室外的小谢和小涵人非常好为我们介绍了很多好玩的地方。谢谢他们。为他们电赞,0.9995191812638021
天沐温泉度假村,温泉水很好特别的清澈，设施设备也很完善，大小毛巾都有，室内小魏小姜服务特别好，及时的为我解决问题，整体体验非常好，下次还要来。,0.9984217516069971
天沐温泉度假村,给瘦西湖温泉度假村点赞，推荐～，温泉种类非常多，池子里还有中草药成分，泡完非常舒服，楼上的小丁和小钟服务非常棒，服务热情周到。,0.9999991205440554
天沐温泉度假村,非常开心过来玩，难得休息一次，前台小苗服务很好，小姚给我们推荐了合适的票价，水很舒服，空气也好，非常推荐的,0.9826108794594461
天沐温泉度假村,扬州非常有名的温泉，坐落于瘦西湖畔。去的时候已经是接近黄昏，空气有点小冷。但是下水后立马感受到暖暖的泉水带来的舒爽。这次只是匆匆体验了一下，下次尝试一下别墅的特级感受,0.9987693903234903
天沐温泉度假村,房间很干净～温泉也泡的很舒服，里面有地暖和干蒸简直是惊喜～更赞的是服务态度非常好！非常好！非常好！客房部管家孙秀春阿姨特别照顾房客，还会主动送上一些小零食！真的非常赞,0.9606148536861991
天沐温泉度假村,瘦西湖温泉度假村值得来游玩，地理位置可以，环境不错，服务一流，温泉有室内和室外，二楼的小丁和小钟服务很棒，介绍三楼电玩玩法！,0.9999260003777382
天沐温泉度假村,环境好 风景好 令我印象深刻的是更衣室的小金和小钟 帮我照顾孩子 还拿了宝宝喜欢的小猪佩奇拖鞋 玩得很开心 二楼还有宝宝玩的地方 也很不错,0.999999576456102
天沐温泉度假村,泡温泉非常舒服，风景非常好，池子的温度非常合适，一楼有免费的量血压，楼上的小钟和小丁服务给他们点赞，带着我们到影剧院看电影！,0.9973249809444582
天沐温泉度假村,小常的服务态度特别棒，不错的一次体验，以后会常去，继续享受他们的服务，同时也感谢小席帮我寄存物品，出来了主动提醒我们别忘了寄存的行李，值得推荐。,0.9991493037287218
天沐温泉度假村,和朋友一起去泡温泉，感觉很好，可惜白天没时间，晚上泡的，有点匆忙。有机会下次白天再泡一次，好好享受一下。,0.2414766700951737
天沐温泉度假村,室外温泉吃非常的多，有火锅池和麻将池，玩得很开心，服务也不错，二楼的小丁和小钟服务棒，手机没有电了，借充电器给我用，谢谢！,0.9945946760444772
天沐温泉度假村,第二次来瘦西湖温泉度假村了，但是感觉没有第一次那么愉悦，池子关闭，也没有喝水的地方，池子还比较拥挤，感觉不会再来下次了。,0.8596098325566358
天沐温泉度假村,室外的小谢和小涵人特别好，为他们俩点赞。天气很冷他们很主动帮我更换了毛巾。这里的服务超级棒。环境也没话说。下次一定再来。,0.6421144366894388
天沐温泉度假村,服务很好，值得推荐，二楼的小丁和小钟服务很不错，印象很深刻，给我送了好喝的银耳莲子羹，介绍了电影，书房，健身房，挺好的。,0.9999994023374555
天沐温泉度假村,位置特别好，停车方便不用走特别远，冬天泡刚刚好，室内服务也特别好，一进更衣室小魏小孙就热情问好帮我找柜子，拿拖鞋很贴心。,0.9971642346833162
天沐温泉度假村,推荐，温泉很舒服，泡完温泉在二楼休息的，看了个电影，小丁和小钟服务很好，特别热情，给我盖毛巾，送了红枣茶，下次还要再来玩,0.918906539959815
天沐温泉度假村,温泉很好，水很滑和家人一起来的，今天周末人比较多，服务也非常到位，特别是室内小魏和小孙两人，帮我小朋友换衣服，非常感谢。,0.9743286784033359
天沐温泉度假村,和家里人一起来瘦西湖玩，走累了在旁边泡了个温泉。今天下雨泡温泉还是蛮舒服的，进去之后地方还是蛮大的，带孩子进男宾后有个小魏和小姜给我们热情的服务，介绍了扬州周边的旅游景点，吃饭的地方，还帮我照顾小孩，服务很棒。,0.999983391047134
天沐温泉度假村,十月维扬秋意浓，普天同庆下扬州。 入住瘦西湖温泉度假村物有所值。酒店式园林风景优美。入住更有精美的礼品相送。 午后与家人一起前往公共温泉区沐浴温泉。我母亲年纪较大，行动不方便。泳池的小周和小韩待我母亲十犹如家人一般。搀扶上下台阶。担心我母亲着凉还为她拿来毛巾。十分感谢并在此予以表扬。 此次扬州之行十分令人满意。,0.9999928115510637
