景点,comments,score
天沐温泉度假村,服务很好和朋友第一次来很开心很好玩游泳池  前台小曼和小吴服务很好 值得再来  中药跑吃很多  好有端午节礼品送很开心哦 下一个节假日再来游玩 亲水湾也很值得推荐哦 ,0.9999999711344683
天沐温泉度假村,前面的小仙女很漂亮，小金服务很好，带着我们泡温泉，介绍了很多池子，有孩子玩的，有玫瑰池，牛奶池，一对一的服务太贴心了，二楼的小丁给我们送了水果，相当不错,0.9999889112501771
天沐温泉度假村,女宾两位小姐姐服务太好了，我记得是金美女和侯姐姐待人很亲切，送了万圣节的糖果，帮孩子吹头发，服务真的是没话说，风景也很好看，不错不错,0.9999998515627364
天沐温泉度假村,太适合度假了，小仙女全程陪同，孩子也很喜欢这个仙女，小金介绍了合适的温泉池子，还带我们到二楼吃水果，小钟***也很贴心，以后还来,0.9987176961652923
天沐温泉度假村,店家服务很好??有很多好玩的 夜市很好玩 有很多好吃的 瘦西湖温泉环境很好很多好玩的前台小曼和小席服务很好。吃的很多 中药??泡池很多很舒服 水果很新鲜值得再来,0.9999999274657146
天沐温泉度假村,酒店的服务，是国内N0.1的。细节也做的非常好，如果你能到扬州，住这里别墅房，一定夫人满意，孩子高兴。我很少给酒店五分点评的。建议入住三天以上。销售汪蕾认真负责(敬业)。,0.28495756598741007
天沐温泉度假村,去的时候正好有活动 小朋友玩得特别开心 就是下午蚊子特别多 特别多 特别多啊 带孩子的话 最好带防蚊喷雾 温泉整体还不错 周末去的时候人也不是特别多 是个带娃玩的好地方,0.9989427783663791
天沐温泉度假村,店家服务很好 端午节活动很好玩送了很多礼品 前台小曼和小晶服务很好值得表扬，给我们推荐怎么玩温泉，服务超棒很有耐心，和朋友一起来超开心的玩耍，下次还来玩,0.9999951360868582
天沐温泉度假村,瘦西湖温泉度假村无论从配套、设施、服务，环境、水质都非常炒鸡棒，是我去过最好的一个温泉。,0.45304030455610567
天沐温泉度假村,五星好评，瘦西湖温泉度假村必须点个赞，极力推荐！ 今天过来泡温泉，第一次来，室外的小谢和小涵给我介绍温泉知识。人挺多的，水也很干净，二楼还有休息大厅。推荐大家玩呀！嘻嘻,0.9988313815531018
天沐温泉度假村,管家何兰香服务非常好，表扬一下。下次还住这里,0.8116766751264862
天沐温泉度假村,【景色】景色宜人 特别喜欢露天泡澡 空气特别好,0.9998856773071524
天沐温泉度假村,下雪天去的，感觉非常棒，重新装修过了，池子没有以前多了，但是环境依旧很好，自助餐厅装修过了，改点餐了，环境不错，值得推荐!,0.9998396856616446
天沐温泉度假村,环境很好，服务也不错，推荐大家来泡个温泉。这边有许多特色的泡池，每个池子里面都加了中草药，下午还有泡泡浴，特别可爱。两位小赵服务都很好推荐。,0.9996680153991833
天沐温泉度假村,反对长篇大论，就给几个tips供大家参考，1这个是天然温泉 ，种类很多，下午人少，可以逛完瘦西湖，问问工作人员从哪个门出来最近，就说去瘦西湖温泉酒店，或者百度查。我有个门出来就是，2 里面有室外泳池，水换的很勤 3 门口有个扬州宴，是很珍珠餐厅吃完可以来泡,0.9494801071321908
天沐温泉度假村,扬州瘦西湖温泉度假村位于瘦西湖景区内，风景秀丽，温泉天然，我们进去够感受到前所未有的礼遇，服务人员很有礼貌，很体贴关心游客，尤其是黄慧敏、张悦、董敏等服务人员耐心细致的引导，解释工作让人感动。温泉美中不足的是二楼餐饮品种过少，希望能够增加种类。好事非常不错的地方，值得一去。,0.999999997520014
天沐温泉度假村,这次匆匆去的扬州，提前一天订了瘦西湖温泉度假村，房间里干净整洁，洗漱用品都消毒杀菌之后密封包装，晚上还送来了酸奶，孩子很喜欢。酒店还可以根据床位数免费泡温泉。酒店就在瘦西湖风景区的东门，周边环境很好，是天然的氧吧。退房时还送了小礼物，家人都说这次住房最值了，下次再去扬州，还要住在这里。,0.9999695661005363
天沐温泉度假村,来泡温泉的人不太多，水很热，我们还在麻将汤里打了一晚上麻将哈哈哈，有几个汤好像没有开，晚上太黑也不敢往小林子去，白天挺热的晚上还是比较冷的,0.0001978588620089594
天沐温泉度假村,前台两位小赵服务很好，推荐了合适的温泉池，即使有一点点下雨但是丝毫不影响我们拍照泡温泉，今天还好，不是很热，和同学考完试一起来的，很开心,0.939927921319571
天沐温泉度假村,瘦西湖温泉还是很不错的休闲去处，二楼还有儿童游玩区，有免费的水果，三楼还有健身房和瑜伽室，还有游戏机，一个小型的电影室可以点电影看，在里面待一天也是没问题！,0.9998675162177031
天沐温泉度假村,瘦西湖东门，风景如画。 温泉设施新，服务及时，干浴巾敞开供应。小鱼池还要收费，这点小气了点。 如住酒店，泡温泉更方便，晚到十二点才结束。,0.0033693223615004486
天沐温泉度假村,这边的小仙女锦瑶和锦雪服务很好，带我们去泡温泉，推荐了玫瑰池和牛奶池，二楼还有水果，休息大厅，这边很适合旅游，第二次来了，还是那么亲切,0.9329843160299772
天沐温泉度假村,跟家里人一起来的，里面的两位服务员，邰姐姐和侯阿姨带人亲切，帮我们拿了泳衣待装泳衣，那泳衣，开柜子，这里的服务真是好的没话说，强烈推荐,0.9939639165390793
天沐温泉度假村,扬州很美，夜市开了，可以来玩逛完夜市过来拍泡个温泉，前台两位小赵服务很好，推荐的门票很优惠，很适合我们，下次还会来！推荐这里，打卡圣地,0.9956777556750116
天沐温泉度假村,温泉挺好的，晚上人少，环境幽静，更衣沐浴的地方都比较干净，服务员态度很好，只要见到客人都会主动问好，笑容很多。园内空气清新，听着来自大自然声音，整个人都很放松，在旅游期间泡温泉，是非常好的体验！,0.9997517928646259
天沐温泉度假村,和同学来泡温泉，遇到了两位姐姐服务态度超好，今天万圣节还送了我们糖果，一位是姓金，一位姓侯，池子很多特色的，值得推荐，这个天泡很暖和,0.9915263007874839
天沐温泉度假村,整体都不错，就是下午两个休息室只开了一个，餐厅没有什么吃的了～ 建议下午还是要开餐的，毕竟假期去的人时间不统一，最好每个时段都有吃的～,0.7991409748839967
天沐温泉度假村,瘦西湖温泉度假村是扬州很有名的温泉，就在瘦西湖旁边，非常不错，里面环境很好，有很多泡池，价格也不贵，挺不错的，推荐一下，可以去看看。,0.9999957371122042
天沐温泉度假村,非常值得，这样买省了很多钱，温泉超级棒，春江花月夜超级棒。携程上买真是省了好多钱，我觉得自己已经爱上了扬州了。舍不得回去了怎么办。,0.9443668008227929
天沐温泉度假村,环境很不错，而且人也不是很多，不仅温泉区不错，二楼的休息区也很好，但结账的时候有个小插曲，尽然把不是我们的帐结到了我们头上，还好结账的时候多看了一眼。但也很快给到了答复。,0.87798434496608
天沐温泉度假村,小赵小苗给我们讲解了温泉的设备 我们玩的很开心 这里环境很好 很气派 非常适合节假日带朋友家人出游 闺蜜聚会却也很合适 二楼的休息厅很好很大,0.9999944277712008
天沐温泉度假村,园林式温泉景色优美，泡过那么多次温泉这里最让人满意。水温非常舒适，泡完之后很舒服，室外的小谢哥哥给我们推荐了鱼疗池。非常好玩。还有一个个子高高的黑黑的小哥哥服务也很棒！,0.9999990589593015
天沐温泉度假村,这边的侯师傅服务态度很好，又拿浴巾又拿拖鞋的，小仙女锦瑶带着我们去跑温泉，她们穿的衣服很好看，以后要是朋友一起来，穿汉服很好看,0.041248516828551574
天沐温泉度假村,二楼的服务员小丁同志和钟美女的服务很好，帮忙照顾儿童，送了果盘和茶水给我们，介绍了儿童玩的地方，两个孩子玩的挺开心，下次还会来,0.9997876209964728
天沐温泉度假村,环境很好??服务很棒 有很多中药泡池很适合老人??前台小曼和小苗服务很好??值得再来体验 水果新鲜好吃??性价比高，总体超赞，,0.9999991847198287
天沐温泉度假村,"瘦西湖风景区东门出来,马路对面就是温泉度假村的入口了。携程现场购票秒买秒到,和现场价格是一样的。整体环境还是很不错的,更衣室也很干净。室外的温泉池子还挺多（现在人不多,没有全部开放），可以根据自己的喜好选择。泡好温泉后，可以换上温泉馆的休闲衣到二楼的休息室躺下来看看片子或者闭目养神。二楼前台可以凭手环领一份小水果。工作人员服务也很好,整个体验还是不错的。",0.7461434256987932
天沐温泉度假村,真正的温泉，有涩涩的味道，小鱼池被咬的痒痒的很有趣，适合居家来体验。还有干蒸房躺在热瓷上枕着小木枕很有韩剧的感觉，服务员非常热情周到。二楼休息厅有躺椅和送的红枣茶和水果小盘，整体体验还可以，没事可以来玩。,0.8919318155331175
天沐温泉度假村,服务堪比海底捞！我们是带了孩子老人一起，服务员全程贴心，帮拎行李，帮忙找婴儿车，泡温泉全程指引。酒店内的细节非常棒，浴袍内面是绒的，贴身非常舒服。泡温泉的地方还有专门甩干的机器，很方便。至于价格，我们家庭套房两室一厅，一千出头一晚，平均每间房五百多，超级性价比啊！,0.8020983406369958
天沐温泉度假村,元旦去的，本来担心有点冷，结果冬天发现泡温泉真的可以泡到发热。泡完温泉室内游乐也很舒服，超喜欢桌上足球，再增加一台就更好了。唯一不足是浴巾额外租的，但是换一个池子就会变湿变冷，中途没有干的可以更换。,0.0006485815113781435
天沐温泉度假村,女宾的候大姐和金美女服务很好，热情招待，里面的环境很棒，很适合这个天来泡温泉，温泉池也有很多，很是值得推荐，会常来。,0.9813274505494314
天沐温泉度假村,前台小姐姐服务体贴周到，尤其是小赵和小苗很棒给我们推荐了合适的温泉泡池 里面的泳池也很有意思 推荐这里 前台小姐姐很可爱,0.9995114611632687
天沐温泉度假村,环境优美，温泉水质干净，服务人员态度很好，尤其要夸奖保安小姚，当时因为东西多，他热情过来帮忙，为他点赞??以后有机会会多多带朋友过来,0.9241925424409972
天沐温泉度假村,很不错的一次旅行，带着父母一起来的一进来就有个姚美女热情的接待，服务态度非常好，温泉也很多，各色个样，用途各异，非常nice！值得一去，冬天度假好去处,0.9956900937030819
天沐温泉度假村,全家三人真是来对了，停车场方便停车。工作人员服务很好！泡澡的池子挺多的，水质干净，水温刚好。泡完澡可以去休息大厅休息，并且还有儿童活动区域。物有所值！,0.8245231372064418
天沐温泉度假村,今天入住瘦西湖温泉度假村，环境赞安静没得说，最让人舒心的是客房服务的孙阿姨，贴心热情，及时送来儿童拖鞋，还给宝贝送上了可爱的公仔，让旅途变得非常温馨！,0.9999997792013585
天沐温泉度假村,在这个暖暖的春季，来了瘦西湖寻春，春意盎然一派欣欣向荣的景象，特别心旷神怡，赏心悦目。瘦西湖也算是文明全国，虽然不及西湖，也挺不错,0.9999999996918023
天沐温泉度假村,小吴小溪服务周到！推荐了合适的温泉池，这里环境很好空气清新，适合度假，推荐哦温泉池很僵很好，很干净，期待下次,0.99998204251535
天沐温泉度假村,鱼疗的感觉特别好，感觉身上干净多了哈哈，有十几个温泉池，各种疗效，泡着温泉喝着果汁太美了,0.8220160636298355
天沐温泉度假村,度假村环境很好，这边工作人员服务都很周到，前台小思小席服务态度不错，以后每年都要来，有趣好玩，总体超赞，,0.9999702801939302
天沐温泉度假村,前台小姐姐服务很好 人美心善 露天温泉很对 空气很好 适合度假旅游 下次还会来 两位小赵很好棒  下次还会再来 推荐这里,0.9977915482902369
天沐温泉度假村,温泉体验感不错，服务也很好 特别是前台小朱和小吴出去时！送我们出来。下次还会再来。 环境很好，体验感超级强,0.9992957302723506
天沐温泉度假村,前台小姐姐很体贴，给我们讲解了温泉的沐浴事项，大唐很气派，空气很好，环境很好，还会再来，小吴小西很棒！,0.9999963328933101
天沐温泉度假村,扬州瘦西湖畔的温泉度假村不仅可以欣赏到瘦西湖的美景，更是大家冬季来扬州的最佳选择。温泉数量众多，房价适中，达到了休闲度假与自然美景的魅力结合。,0.9999944725922985
天沐温泉度假村,确实不错的地方，我基本每月都来一次，锦泉仙子服务不错，又送礼品，礼貌热情！下次有机会带员工过来团建！,0.9935003681082502
天沐温泉度假村,晚间去泡温泉很舒服，灯光很好看泡了几个池子高中低温都有能满足大家的需求，有地热房、干蒸房，泡完蒸一蒸喝点果汁正好，休息室内姜涛服务好倒茶送免费水果，离开时小魏也服务好一直送到出口。,0.9840511857303557
天沐温泉度假村,跟朋友一起泡了一次温泉，他们家给我的第一感受就是服务热情，随处都能体会到，一进门到我找到自己的柜子都有服务员服务，小孙和小魏给我介绍了他们家各种各样的温泉让我提前知道自己想去的温泉池，很感谢他们。泡温泉的时候我拖鞋丢乱了也有服务员大姐帮我摆放整齐方便我穿，一些小细节感觉很贴心。感觉泡的很舒服下次还要跟朋友一起来玩。 【景色】,0.9971863284833421
天沐温泉度假村,旅行中的一站，挑了个离瘦西湖近的酒店――瘦西湖温泉度假村。村中人都很热情，服务炒鸡棒！泡温泉的时候提醒我们注意事项，介绍周边特色。出来买单的时候，收银的小吴和小丁很热情的问好，并给我们送出卡门。服务很棒哦！会推荐亲友再来的！！！,0.9999999192087449
天沐温泉度假村,扬州温泉挺有名的～过节泡温泉??还可以。人比较多，小朋友(?°3°?)喜欢，二楼有儿童乐园，上楼有水果吃，还有跑步机，瑜伽球**.可以呆一下午，玩个尽兴，前台小锦仙子和晶晶小姐姐特别给力，介绍详细玩法，给我们不少建议。下次还会再来，忘记说了，温泉水质不错，跑完滑滑的//推荐哦(′-ω-`),0.977128907212338
天沐温泉度假村,在里面享受温泉就好了 不一定要住在度假村里 毕竟贵... 但是夏天会有各种优惠套餐！相当于买温泉送一晚 那是真的爽 来瘦西湖一定要来温泉玩耍一下 一个下午/晚上 扫去旅途的疲惫 里面吃吃喝喝差不多人均60-70 我觉得OK 带小孩or带爹妈来的话非常不错的安排啦～,0.9999812494236504
天沐温泉度假村,瘦西湖被誉为“具有重要历史文化遗产和扬州园林特色的国家重点名胜区”，也是扬州首家国家5A级旅游景区。瘦西湖景区内有御码头、五亭桥、冶春园、绿杨村、卷石洞天、四桥烟雨、长堤春柳、木樨书屋、梅岭春深、莲性寺、白塔晴云等景点。瘦西湖“L”形狭长河道的顶点上是眺景最佳处，由历代挖湖后的泥堆积成岭，登高极目， 全湖景色尽收眼底。,0.999999999999305
天沐温泉度假村,前台小西小四服务很好，推荐了合适的门票，学生票很优惠，晚上泡温泉很好，空气很好，环境很好，推荐,0.9935606349796127
天沐温泉度假村,小四小溪服务周到 今天人不多 下雨天 还可以 不是很热这里环境很好 推荐这里 还会再来的 推荐 泡泡浴很有趣,0.911336049606525
天沐温泉度假村,前台小苗小西服务很好 推荐了合适的门票 温泉池很多 水温合适，可以随心选择 温泉景色很美 服务很好 很好,0.9998121459064793
天沐温泉度假村,瘦西湖的温泉一直是去扬州的必去项目，买点饮料在温泉里喝，好不惬意。整体环境很好，也比较干净，很适合晚上放松一下，建议周末可以经常去。,0.999982479165252
天沐温泉度假村,小四小西服务贴心周到 推荐的池子很好 很适合我们 这里空气很好 环境优美 适合度假 下次还会再来 推荐这里,0.9999978574062458
天沐温泉度假村,瘦西湖温泉酒店就在体育公园边上。西湖边上有人间。豆腐可以切成和丝线一般细，也是醉了。还有丰富的扬州炒饭驰名中天下,0.9913002402016571
天沐温泉度假村,晚上的夜景非常非常漂亮，晚上泡温泉很不错，服务员小谢，小含服务很棒，过来给我调整温泉池的温度，水温很舒服，还推荐很多优秀的区域。毛巾潮湿了及时给我们更换，很好的一次体验。,0.9513188102586659
天沐温泉度假村,烟花三月下扬州，和闺蜜特地过来泡温泉 度假村离瘦西湖景区非常近，出行也比较方便，性价比高 酒店服务特别好，令人满心愉悦，下次再来！,0.9999978885697957
天沐温泉度假村,瘦西湖温泉第一次来，这里环境十分优美。冬天室外好冷，但是泡着温泉水温十分舒服。服务员小谢和小涵服务态度非常好，为我送上了姜茶也为我更换了干毛巾。为他们点赞。补充一下，那个冲背的池子太棒了,0.9757806414006401
天沐温泉度假村,有趣好玩，性价比高，景色不错，总体超赞，小赵小赵，泡得很舒服呀环境好，天天泡温泉就好,0.9999994471557524
天沐温泉度假村,酒店不错 就是独栋的大家庭房感觉有点潮湿的味道,0.579967717211821
天沐温泉度假村,酒店挺好的，非常安静，温泉也不错，温泉池很多。适合全家来。酒店好像在公园里面，去住时赶上活动，交通管制，酒店大门比较难找。,0.9237559936408322
天沐温泉度假村,这里的温泉有文化内涵，很喜欢温泉里的书吧。泡完温泉吃一份免费的水果很舒服然后休息一下看看书离开一下手机，里面的服务很好现在到哪环境都差不多就是奔着这里的服务来的，服务员很机灵总是在你需要的时候就帮到你，男汤小孙不可多得的好服务生，还有小魏帮我们联系在女汤的客人把我们一起送上楼谢谢,0.9999574195492761
天沐温泉度假村,晚上去泡温泉的环境很漂亮，温泉水温度也刚刚好很舒服，更衣室小魏小孙服务热情，拿毛巾帮我擦后背，又给我拿塑料袋子的，服务非常热情，下次还要来。,0.19456269747098565
天沐温泉度假村,浴室里面的小钟和小金两个人的服务真好，当时人很多，我的柜子打不开，小金看到立马过来帮我打开了柜子，告诉我带好自己的钥匙牌，洗完澡小钟美女帮我甩干泳衣，还用袋子装好，这么细致的服务还是第一次感受到，特别提出表扬。,0.0005374149274558482
天沐温泉度假村,温泉度假村很不错，里面环境很漂亮，工作人员也热情，温泉池很多，各种不同的温泉池，里面的服务员能够给我们姐们介绍，上水喝，服务很棒，外面还有一个大泳池，水很清，很遗憾，我们游泳不太好，泳池工作人员小谢，黄晗，服务很好，给我们指导，小伙子们很棒。,0.9990189608943988
天沐温泉度假村,看了别人的点评说上午人少，于是我们上午11点多到的，确实上午人很少，池子里都没什么人，安安静静泡的很舒服，下午人越来越多，休息区连坐的地方都没有了，吃饭的地方也没有座位，整体泡澡还是不错的，就是休息的地方还需要改善一下。租浴袍要15元，但是可以不用租，有浴巾拿，而且很多地方可以拿到干净的浴巾！,0.021464170209614664
天沐温泉度假村,性价比超高，入住就送双手温泉，儿童1.4米以下免费，早餐也蛮丰富的，扬州宴餐厅的菜好吃又实惠！服务员服务特别周到，刚到前台办入住，就送宝宝一个小礼物，在房间打电话借过充电器，创可贴，晾衣架。下午还有服务员到房间送酸奶，房间咖啡，茶叶，冰箱的听装饮料，矿泉水全部免费的！,0.9998388362997438
天沐温泉度假村,今天中午入住酒店，午休后去瘦西湖游玩，晚上回来后房间已经重新整理过，还收到了客服经理贾荣华女士送来的贴心小礼物：糖果、水果、520蛋糕。特别要一提的是：我夫人明天（520）过生日，酒店送来的小礼物令我们很惊喜。感谢酒店，感谢贾经理！,0.9999931091052688
天沐温泉度假村,网上当天现买的，验券还是比较方便的，服务员挺热情的，大厅气派，里面感觉池子不多，汗蒸，地热，什么的，都有，楼上有休息室，每个沙发都配个电视机，所以有点吵，休息区也只开放了一个，可能不是周末忙档。大厅里的自动售卖机，卖的椰子汁，赞一个！,0.00010263481111072448
天沐温泉度假村,《带有缺憾的完美旅行》――这是我离开度假村时就想好的题目。缺憾，是我自己造成的，但是整个旅行的过程是完美的。5月3日下午，从扬州客运总站打车前往度假村，到达以后下车取旅行箱，不慎右手无名指被车后盖压伤了，鲜血直流。直奔大堂，遇到客服小毛（后来才知道她是一位实习生），她赶忙带我到温泉区二楼医务室。值班的医务人员小梁马上帮我消毒、止血、上药、包扎。两位小姑娘还不停地安慰我，交待注意事项。第二天下午，我们外出游玩回来，又是小毛陪我上医务室请小梁换药。晚上小毛来电，明天她休息，但已经安排好了，明天下午小梁还会来帮我换药。第三天中午，我们办完退房手续，小梁又耐心地帮我换药。考虑到我们还要去镇江玩几天，她还帮我准备了消毒药水、棉花签和创可贴等等，使我非常感动！我们是一对年届七旬的老人，扬州三日，给我们留下深刻印象的不仅仅是瘦西湖、个园、古运河、大明寺、平山堂、东关古街等名胜古迹厚重的历史、美丽的风景和齿颊留香的淮扬菜，更加暖心、更加难忘的是扬州人民热情真诚的待客之道，以及充满人情味的、淳朴的民风。这次我们来扬州，来对了；入住瘦西湖温泉度假村，住对了――仅以此小文，向小毛、小梁和度假村的员工们致敬！,0.9972150175438396
天沐温泉度假村,晚上去的，在市中心地方，离下榻酒店比较近，直接走过去的，环境好，服务热情，有很多小池，都很舒服，就是我是网订的门票含鱼疗，到小鱼池的时候没人管，就直接进去了，泡了一会，一个工作人员来问要收费的，我说门票里面含了，她说她们这边鱼疗都是单卖的，从来没听到过含在门票内的，给她看了手机里的订单才相信了，希望在这方便多培训一下，搞得很尴尬啊,0.00046596400667286986
天沐温泉度假村,听朋友说瘦西湖的温泉好玩特意开车过来的，两个人团购了双人票很合算，里面项目挺多，负责也不错，特别感谢谭**和刁阿姨，很用心的给我们介绍过各个项目，很贴心的服务，下次约朋友继续来玩,0.9999997756712448
天沐温泉度假村,前台小赵和小苗很可爱 推荐了合适的门票 这里环境很好，空气清新 夏季泳池体验很好！,0.9961739490350645
天沐温泉度假村,今天来泡温泉很舒服，环境很好，服务也很好，二楼的休息区很大，影院的沙发很舒服还有宝宝玩的儿童乐园，小丁和小钟服务很不错，给我送水果和红枣茶，下次还要再来！,0.9997808007910111
天沐温泉度假村,住宿非常好，特别干净舒心服务也是一流的，还有水果赠送，边上就是古运河，夜景可以兜兜逛逛有来扬州的朋友可以选择，赞,0.9999995747740679
天沐温泉度假村,小西小四服务很好，温泉水很干净的 这里的工作人员很贴心 有美味的水果 很棒,0.9998966271254146
天沐温泉度假村,温泉很舒服，服务也不错。但是如果要游泳的话，请一定好记得，带好泳帽！,0.9313623922264624
天沐温泉度假村,性价比不错，景色很美，大人小孩都玩的很开心。换票很方便，还用了鱼疗。,0.9999983611806563
