景点,comments,score
天沐温泉度假村,很赞，温泉小而精致，特别适合一家三口玩，可以体验不同的温泉；楼上有专门的休息区，泡完可以休息下，看看电影，还有专门小孩玩的游乐场；媳妇孩子都很满意！,0.9965435826951801
天沐温泉度假村,酒店环境很不错，自助餐也性价比高，尤其服务人员热情，耐心，接待的服务员叫李雳雷服务让我感到宾至如归，非常棒！,0.9999912000576451
天沐温泉度假村,第一次过来泡温泉，之前都是去别的地方泡温泉，一直不知道扬州还有这么好的地方，这次真的是来对了，前台的服务很好，尤其是小猪和小源，服务特别棒，惊喜！,0.916175518800293
天沐温泉度假村,前台的小董和小苗服务态度很好，特别热心的为我们推荐啦优惠票，里面的温泉吃形态各异种类很多，水也很干净。和家人一起过来玩的很开心,0.9550563674977288
天沐温泉度假村,从广东来扬州玩 特意找到了这家温泉酒店 温泉泡的很舒服 水质也好 各种各样的池子 泡的很舒服 点名表扬露天的汪阿姨和张悦 服务很好 热情周到 玩的很开心 下次还会来的,0.999899782304541
天沐温泉度假村,相当好的温泉，环境很棒，设施也蛮好的，最重要服务态度一流，尤其两位新来的实习生，黄慧敏，张悦。服务热情，主动询问是否需要水和其他服务。为她们点赞。,0.9996956888834229
天沐温泉度假村,零下八度去泡的温泉，真是冰天雪地泡温泉啊。除了刚出来那会有点冷，下去温泉池里不用担心，一点都不会冷，很舒服。里面更衣室，冲澡都很干净，整洁，推荐。,0.20916266799077887
天沐温泉度假村,温泉很赞。大大小小几十个池子。挨个泡，连孩子也喜欢。所以已经去过两次。有机会再去。性价比不错。价格家庭可以承受。季节性也不强。即便冬天去也很舒服。,0.999955700659528
天沐温泉度假村,第一次来瘦西湖温泉度假村泡温泉 是听朋友介绍的 这家温泉酒店服务很好 环境优美 空气清新 前台的两位小赵服务很好 温泉池很多 天然温泉 很棒,0.995578970772932
天沐温泉度假村,今天带着女朋友过来泡温泉，温泉区景色优美，池子很多，水也很干净。女宾的小董和小侯服务周到。二楼还有休息大厅，凭手牌还能领水果吃！推荐大家来玩啊！,0.9951869934468264
天沐温泉度假村,前台的小习态度很好，操作娴熟。收银的小文长得很好看，笑起来很美。里面池子很多，水也很干净。乘着放假和朋友一起过来玩的很开心！,0.9994016438982654
天沐温泉度假村,很棒！环境特别安静，早餐有特色，温泉舒适。孩子们喜欢，管家贴心。,0.9999284314247625
天沐温泉度假村,和家人一起过来泡温泉前台的工作人员服务特别好，给我推荐的门票很合适，尤其是小思和周丽服务很好，还有小丑小哥哥小盆友很喜欢，下次还来，推荐这家店,0.9968860572068855
天沐温泉度假村,外地过来泡温泉，前台的小董和小苗给我推荐了优惠券，非常感谢，里面的温泉池很多，水也很干净呢，和家里人玩的很开心 一百还会再来,0.4821372728663921
天沐温泉度假村,烟花三月下扬州 这里的景色非常好 春天了各种花都开了 仿佛人间仙境啊 温泉水质也很好 泡的很舒服 印象深刻的是两个服务员小董和黄伟 服务态度非常好 给他们点赞,0.9998880792188638
天沐温泉度假村,周万云 李英的服务非常好！知道我们温泉回来还给我们特地送了水果和酸梅汤，非常的贴心！,0.9927755674582798
天沐温泉度假村,女宾的小钟和小金服务热情，很会照顾人，二楼有休息厅，还有免费的影剧院，有水果，还有泳衣可以甩干，帮我们装到袋子里，谢谢她们的服务，下次还会来,0.9986957929271241
天沐温泉度假村,前台的小曼操作特别熟练，小姚的服务很好，很亲切，玩的很开心，温泉水温度很合适，环境也特别好，空气清新，推荐大家过来玩的呢,0.9998818525945903
天沐温泉度假村,一起来瘦西湖温泉度假村泡温泉前台的小哥哥小姐姐服务都特别好，尤其是小吴和小猪的服务，让我感觉很贴心，新增的温泉池特别有意思，下次还会再来。,0.9999977687775211
天沐温泉度假村,前台的小董和小弈给我推荐啦优惠票 今天人也不是很多 二楼的休息厅还有水果吃 温泉种类很多 谁也干净 和朋友玩的很开心 还会再来 嘻嘻,0.9565194331160778
天沐温泉度假村,里面环境还不错，这次跟朋友一起去的，下次准备跟家人一起去。,0.973326159641326
天沐温泉度假村,瘦西湖温泉的服务很周到，我呢基本五分钟换一个池子，真是对不起一直在池子边认真摆正拖鞋的小哥[捂脸]，在休息区看柯南剧场版也很开心，差点睡着,0.5453123537577134
天沐温泉度假村,要是玩3~5天的话，还是可以住在这边的风景依然比较幽静。,0.9796660982374511
天沐温泉度假村,今天来泡温泉感觉非常不错，天气也刚刚好，泡的非常舒服。在更衣室碰到的谢帅哥很是热情，帮我带小孩子，还有外面泡池区有个姓魏的，服务棒棒的。,0.9978434903078215
天沐温泉度假村,非常不错的体验，温泉水非常好，小丁和小钟两位服务员的服务的很好，还赠送了水果，非常热情，对孩子也很有耐心。下次来扬州还会来这里泡温泉的。,0.9976690066322205
天沐温泉度假村,还不错，温泉可以单独玩，小朋友是免费的。1.2以下。老人60岁以上半价，小鱼池是买二送一，满适合玩一天，泡泡很舒服但是时间不能长。而且服务很周到很棒。总体感觉不错，儿子不亦乐乎,0.9999979153250325
天沐温泉度假村,环境好，服务更好，我们同行的老人一冷一热皮肤痒，服务员热心帮忙用热水冲身体缓解瘙痒，涂润肤露，还安慰老人家，叫老人家不要着急，感恩，感恩,0.8429721831447133
天沐温泉度假村,好豪华的别墅，私汤乱赞的，管家李英阿姨和孙秀春阿姨好热情，还给我们在温泉边上准备灯，出去了一圈发现水已经烧好了！不错,0.6011988766465362
天沐温泉度假村,今天520来泡温泉，一到大堂就有小仙女送花花，前台小席和小曼服务都是棒棒哒，超级喜欢这个小花花,0.11569774037405045
天沐温泉度假村,第一次来，不太会用这里的设备，于是问前台的小姐姐，小姐姐服务很好，告诉我们这里有儿童乐园，还有免费提供的饮品，小苗和小赵服务很好，谢谢,0.5066104720471017
天沐温泉度假村,环境优美，风景很好，二楼休息大厅环境不错，红枣茉莉花茶特别好喝，有新鲜的水果，服务员微笑特别好，小刁和小谭给我们亲切感，下次还会再来。,0.9999815420974435
天沐温泉度假村,坏境很好 服务到位 值得旅游泡温泉的好地方 还有好喝的大麦茶,0.9211973195122612
天沐温泉度假村,非常不错的一个露天温泉，比虹桥坊要舒服很多，来到休息厅，小谭与小金服务很热情，瑜伽房也很宽敞。,0.9999095765343744
天沐温泉度假村,老爸老妈一起去泡温泉，池子很多，环境优美。泡的很舒服！,0.8782910259657886
天沐温泉度假村,温泉很好，泡了也很舒服，服务也不错，就是如果与酒店一起定那就最完美了，就在瘦西湖对面，可惜三月人实在太多没订到酒店，只能感受一下温泉了,0.9979169834349725
天沐温泉度假村,帮朋友订的。反馈特别棒！园林别墅，私密安静，关键离市区很近。离各个景点都近。一次愉快的度假经历,0.9996012371722403
天沐温泉度假村,今天过来玩、很开心 小钟服务很好，帮我找到了衣柜，小姚服务很到位，给我们讲了温泉水的温度，二楼有水果可以吃，很舒服的一次温泉享受，开心,0.9983938589508617
天沐温泉度假村,过来泡温泉，女宾的小董和小侯服务态度周到热心。温泉区的尺子很多，水也干净。每位服务员都很热心，周到，赞。下次还会再来，推荐大家来玩，,0.9997907953928573
天沐温泉度假村,管家袁友霞帮助我们沐浴池进行消毒并清刷，给老人铺防滑垫，防止发生滑倒。昨晚下雨，在大门入口铺吸水巾，细心照顾周到，是客户的贴心管家。,0.9478015903815686
天沐温泉度假村,玩的特别开心，去了那边环境很好，服务态度也特别棒，温度正好，特别舒服，希望下次有机会可以再去，这次还带了宝宝去了，宝宝玩的都不肯走了,0.9999735328982805
天沐温泉度假村,总体感觉不错，温泉种类很多，采耳和修脚都很舒服。二楼有休息大厅和儿童乐园很适合家庭出游。服务员小谭和小钟服务非常好，下次还会再来。,0.9598409805977801
天沐温泉度假村,跟朋友过来泡温泉，这家非常的不错，二楼的小丁和小钟服务很好，给我们开电视，有赠送的水果，非常感谢你们，下次再来，推荐这家温泉酒店，,0.3725475884593884
天沐温泉度假村,平安夜过来泡温泉前台的小姐姐服务特别棒。给我推荐的温泉门票和适合很优惠。尤其是小罗和小圆的服务，让我感觉很贴心，下次还会再来的哟。,0.9872411716012773
天沐温泉度假村,泡温泉非常舒服，楼上有赠送的银耳莲子羹和水果，服务员小丁和小钟服务态度好，给我们开电视，介绍三楼，室外池子多，而且干净。下次再来！,0.08287931815276617
天沐温泉度假村,带着家人过来泡温泉 女宾的小董和小杨服务态度很好，耐心的帮我找到了柜子，温泉池很多 水也干净 二楼有免费的休息区 还有小孩玩的地方 推荐哦！,0.7625149955106816
天沐温泉度假村,服务很好到处都有工作人员，设施很新，室外的池子有20多个吧，还有会冒泡的池子，休息室很大沙发很舒服，非常划算！,0.5753647410034696
天沐温泉度假村,真的很不错的风景。大家有空可以过来参观 我很喜欢这里,0.9971757658023146
天沐温泉度假村,难得有空，过来这边泡温泉，小金和小钟的服务特别好，特别细致，二楼有水果可以吃，还可以看书，三楼有健身房，超级开心噢，玩的很高兴，,0.9989863511928223
天沐温泉度假村,玩的非常的开心，非常的方便，下次还会选择携程的。我健健康康快快乐乐健健康康哦哦咯哦。我们自己也许我的时候也好棒棒糖给足你面子工程,0.999982639368714
天沐温泉度假村,挺好的，环境不错，服务也不错，就是到下午的时候没有干毛巾了会很冷，总体来说还是值得来的。,0.9963491363382229
天沐温泉度假村,下午四点去的，刚开始人有点多，慢慢的人就少了，十多个池子泡的有七八个，都是39-42度左右，如果一边下雪一边泡就更别具一番风味啦,0.9352021604597706
天沐温泉度假村,距离杭州市中心很近。环境很优美。服务也很贴心。,0.9994754983061857
天沐温泉度假村,玩的很开心，空气质量好，一进女更衣室，小姚就帮我们找到了柜子，小金给我哦的介绍了温泉知识，玩的很开心，二楼有水果可以吃，推荐哦,0.9928178543297118
天沐温泉度假村,环境很棒啊，我们到的很晚了，但是一点不影响心情。一开始准备去南京汤山泡温泉的，最后因为时间来不及选择了瘦西湖温泉度假村，超值！,0.9989884003309041
天沐温泉度假村,还算满意，毕竟泡的池子也还蛮多的，都有提供热饮和毛巾，比较私密，也适合情侣游玩，印象挺好的，希望有空再过去游玩，都还蛮靠谱的。,0.9964455009757406
天沐温泉度假村,位置很好找，在瘦西湖对面的度假村里。泡池很多，还有适合小朋友玩的泡池和海洋球，小鱼泡池收费，成人99一位，性价比算比较高的了！,0.9999998387719906
天沐温泉度假村,温泉泡池很棒水质干净，二楼水果很新鲜，有很多的设施还有电影看，前台小苗小席服务热情，非常棒的体验，还会再来,0.9966270410490204
天沐温泉度假村,一直想要再去的地方，住宿环境真的很棒，小别墅一家人住刚刚好，还有露天小温泉??，棒极了,0.9474806723905624
天沐温泉度假村,很大很美，适合住着玩，小栋的别墅，院内的小温泉池，很有意思。还有大温泉池，不过没去过，从外面看，环境还不错,0.9899614899061475
天沐温泉度假村,度假村里泡温泉，很舒服，环境很好，特别是工作人员的服务态度特别好。性价比还可以，里面的自理费用也不高，可以接受。下次还会来的。,0.9884909948369728
天沐温泉度假村,地方不错，带着一家去的，很是方便，环境也不错靠近瘦西湖，还能看见游船。汤池也比较多，玩个一两个小时就可以了。节假日不错的选择。,0.9999998145411775
天沐温泉度假村,瘦西湖温泉位置就在瘦西湖对面，温泉真的是非常的棒！各种功效给种温度的温泉池应有尽有，泡了非常的舒服，有机会一定要来这里泡泡啊！,0.9999989855567105
天沐温泉度假村,环境卫生服务态度很地理位置优越 假日休闲的好去处,0.913720616428585
天沐温泉度假村,游览完瘦西湖，泡个温泉享受极至了，房间明亮舒适,0.9990990995935052
天沐温泉度假村,周末没事和老公一起过来泡温泉，女宾的小钟和小姚服务态度特别好。还给我介绍了项目，二楼有水果可以吃，空气超级好，推荐！很棒哦！,0.9623594030257318
天沐温泉度假村,很不错的室外温泉，有各式各样的名目。服务员的态度很好，主动热情。游玩的人不多，对面就是瘦西湖公园。室内设有休息区，比较惬意。,0.9998463458869651
天沐温泉度假村,人还是蛮多的，今天外面很冷，不泡在温泉里还是很冷的，一个一个温泉池还是很小的，泡不了几个人，有的还在维修，其他一切都还可以。,0.00803970795654807
天沐温泉度假村,很不错的度假放松去处，去的时候有20多个汤池开放，环境不错，也很干净，服务特别好，有求必应。小次还会再去,0.9999317244502711
天沐温泉度假村,酒店景色好，安静，地段绝佳，周末去人也不是很多，泡池也很多，服务很好，工作人员见面都会打招呼，干毛巾准备也很及时，还会再来！,0.9943610886989328
天沐温泉度假村,室外池子很多，还有按摩功能的池子很舒服，工作人员不厌其烦地摆鞋子，态度也很好。有免费的水果一份，市内有休息室电影放映很不错。,0.9189537485887015
天沐温泉度假村,带宝宝来泡温泉了，温泉水很好，风景也很好，女宾的小王和小汪服务很热情周到，楼上还有休息厅，儿童乐园，超棒，推荐大家过来玩。,0.9999940106407303
天沐温泉度假村,整体设施很齐全，服务人员随处可见态度很好阿，晚上来的人也很少，泡完去旁边的树林散散步感觉很好，五星好评,0.9965710124727687
天沐温泉度假村,前台的小董和小曼为我推荐了优惠券。温泉池很多，水也干净！带着家人过来泡温泉，玩的很开心，推荐大家来玩哦,0.7007873873721528
天沐温泉度假村,春节带爸妈泡泡温泉，印象很好，大部分服务都很热情，休息区也很周到，在餐厅吃了简餐，价格不贵。携程订票非常方便，还有半价票。,0.12359711698228104
天沐温泉度假村,温泉前台核实了退休证后就给发了手牌 泡好出来后一起结账 很方便快捷 非双休日人少 感觉包场的节奏 几个按摩池很好玩 服务也都很好 很满意,0.2362665846369264
天沐温泉度假村,温泉泡泡真的很舒适，而且那边有很多温泉池。,0.6269926149608677
天沐温泉度假村,来瘦西湖泡温泉了，风景好棒呀，女宾的老侯阿姨和小汪服务很热情，介绍了很多东西，温泉水也很清.棒棒哒！兔推荐大家过来玩哦！,0.9999810622497546
天沐温泉度假村,温泉去环境优美，水池多而且干净，二楼的设备多，有赠送的水果，有影剧院，二楼的小丁和小钟服务态度好，讲解电视适应使用方法。,0.9888021011307808
天沐温泉度假村,前台小苗的操作很熟练，很快，小姚的服务很好，推荐大家过来泡温泉，环境很舒服，空气特别好，难得玩一次，,0.9972049212020844
天沐温泉度假村,"温泉池做的很有特色,各种各样是中草药温泉池，温泉水质干净，前台的小罗和小文服务很周到，总体体验很好。",0.9866786611636408
天沐温泉度假村,第一感受干净，温泉水蛮干净的，路边也很好。整体服务不错，汤池周边的夏春兰阿姨很好，服务到位，和蔼可亲,0.9999654649837161
天沐温泉度假村,前台的小董和赵苗给我推荐了优惠票，并且为我购买了泳衣。温泉池很多，水干净。玩的非常开心下次还会再光顾,0.6483754210510844
天沐温泉度假村,瘦西湖温泉就在 大明寺游玩后，搭乘的士，一个起步价就到达，温泉环境很好，到达酒店柜台换票不在柜台，这次要到另外的地方，上次来的时候很方便，遇见温泉部门的领导，这次，换票，要到其他的地方，这点需要改善耽误不少时间，跑来跑去，希望下次再去能给予方便，不是在携程订票，就这么麻烦好吗？ 谢谢。,0.11452507710758031
天沐温泉度假村,温泉本身很好，泡起来很舒服，亲亲鱼疗项目我很喜欢。而且做活动买一送一超级划算。本来想打五分的，但是叠毛巾的服务员说话态度很冲，问她问题而已恨不能翻白眼，毛巾湿了很冷我们想换毛巾问她干毛巾在哪里，她特别不耐烦就用手指着方向一句话也不说。就算我再问她具体在哪里她也不说话还是用手指着很不耐烦。其他服务人员都很好的就这一个影响我心情。,8.345066554893421e-06
天沐温泉度假村,貌似装修过了，更衣室很宽敞，服务员很多，都招呼得到。温泉的池子很多个，各种选择。泡完温泉本想搓个背，但没有技师，后来到休息区做了个足浴套餐，也挺舒服的，尤其修脚师傅很仔细，死皮基本都修掉了。唯一建议，休息区使用耳机看电视，不然实在太吵了！,0.00042399832656947467
天沐温泉度假村,真的非常不错的一次温泉体验，下次还会来！,0.8637201155423583
天沐温泉度假村,兑换过程还算顺利 买的双人票 300块都没有 然后换衣服 手机套买的没意思 没多大用处 因为可以放台阶上 带个方便袋装一下就行了 。一开始进去好冷好冷 前面几个池子水温不高而且脏 后来到后面 往后面走 有热一点的池子 泡完一阵后很暖和 泡的时间长头都晕了 前后一个小时足够 后来回去洗澡 上二楼休息 凭手牌免费提供一份小盘水果 没了,1.622939360679254e-08
天沐温泉度假村,第二次去瘦西湖温泉，非常喜欢！服务也很到位，交通便利，对面就是瘦西湖景区的东门！,0.999992297189486
天沐温泉度假村,没有时间限制，可以在里面泡很久，有很多不同的小池子，不同的药浴，有不同的疗效。就是蚊子很多，有点影响心情。总体性价比很高，设施服务都不错。临走时还帮忙叫车，挺好的，会推荐朋友来，下次再来会选择住这里。,0.9995767918601955
天沐温泉度假村,温泉，游乐非常满意！是冬天带娃亲子的好地方，价格也比较好！团购价格非常的给力！性价比高，有趣好玩，,0.999481171204218
天沐温泉度假村,室内池子刚下去就感觉水滑滑的、超棒的感觉；室外刚出去很冷，泡了好几趟不同药膳的温泉池，强烈推荐薰衣草和桂花香，特别好闻,0.945267609387712
天沐温泉度假村,瘦西湖温泉位置优越，二楼吃饭的地方味道很好吃哦，技师的服务好，楼上的小丁和小王服务态度很好，赠送银耳莲子汤，谢谢他们。,0.9999807320811168
天沐温泉度假村,非常感谢，温泉效果很好，泡完滑滑的，特别舒服，我们我们下次还会再来一次，服务非常好，前台小赵和小西特别热情。非常满意。,0.9869154832560413
天沐温泉度假村,整体环境不错，就是有几个温泉池没有放水，今天下小雨，微风，路上的时候好冷啊，水里还是蛮舒服的，服务员态度不错，有空再来,0.6804978243999139
天沐温泉度假村,酒店很棒，环境干净，交通便。适合休闲,0.992658401672227
天沐温泉度假村,江南美景看西湖，瘦西湖更是苗条的美！,0.9998840348908249
天沐温泉度假村,跟朋友过来泡温泉，非常舒服，楼上的小定丁和小钟服务态度好，黑给我们连无线网，赠送水果和茶水1非常感谢他们，下次再来，,0.4902563137213677
天沐温泉度假村,来了一次不错，假期活动非常多，前台赵晶和小习真的很好，温泉区水特别好，品种特别多，二楼休息的地方提供水果，下次再来。,0.9698722055045591
天沐温泉度假村,第一次来扬州瘦西湖温泉。这里环境很好。服务态度也很好。特别是露天服务员张悦和黄慧敏。这次游玩非常开心。下次还会再来的,0.9984772937667924
天沐温泉度假村,景区环境不错，浴袍需要单独花钱租，个人觉得没必要，最好下午去，晚上室外温泉有点冷。没有提供免费水果，个别温泉另收费。,0.004939939372856972
天沐温泉度假村,环境很好。。池子也挺多的，还有三个给儿童设计的温泉池，池子里有海洋球，小朋友玩的很开心！二楼休息室也很干净，送水果！,0.9993496440051006
天沐温泉度假村,这边环境服务挺好的，水质干净，二楼休息特别宽敞，做了按摩，这边服务，小钟和小谭服务很好，下次还会带朋友一起来玩的.,0.9675630400862384
天沐温泉度假村,玩的特别开心，环境很好，特别喜欢这边的温泉，女宾的小姚和孙大姐服务特别好，推荐大家过来玩，每个温泉池都很舒服，开心,0.9944429647950573
天沐温泉度假村,很喜欢这边环境很雅致是扬州这边的真温泉水质干净整洁水果也很新鲜收银的小丁和小吴很热情给我们扫停车码还送我们出门谢谢,0.9999554037975575
天沐温泉度假村,第一次过来泡温泉 看**介绍瘦西湖温泉度假村环境不错 就过来了 前台的两位小赵推荐的门票很合适 谢谢推荐 下次推荐朋友一起来,0.9939502328595149
天沐温泉度假村,节假日待着家人来泡温泉，前台的小董给我推荐了优惠票 男宾的小孙很贴心 温泉池对 下次还会再来 推荐大家,0.34091402152396333
天沐温泉度假村,前台的小董和小姚给我们介绍了优惠票 温泉吃很多 环境很好 用手拍还能拿免费的水果 很划算小 下次还会再来,0.9389375346731319
天沐温泉度假村,好好好哈哈哈哈哈哈哈哈哈哈哈哈哈哈哈哈哈哈哈哈哈哈哈哈哈哈哈哈哈哈哈哈哈哈哈哈哈哈哈哈哈哈哈哈哈哈哈哈哈哈哈哈哈哈,0.9999999999999949
天沐温泉度假村,很舒服 就是吃的少 强烈推荐大家买这个10次卡 成人才68一次！！ 我们**买的成人158一个人！！！,0.05268933295997735
天沐温泉度假村,瘦西湖温泉度假村风景很美人很美，设施很好，水温很好，尤其表扬露天服务员！董敏和张悦！服务态度很好很热情！下次再来！,0.999998529197372
天沐温泉度假村,很棒哦 这里的温泉种类很多 水温也可以,0.8161206460104913
天沐温泉度假村,挺好的，舒服。数量也多，环境很好。,0.9312198537720913
天沐温泉度假村,酒店就在瘦西湖对面，非常方便。是园林式酒店，风景不错，房间很舒适，最重要的是有温泉泡，单独付费,0.9991057045719902
天沐温泉度假村,温泉面积很大，池子也蛮多的，就是小鱼池还要收费，还有时间限制，这不太合理！,0.1769279231607701
天沐温泉度假村,服务特别好，perfect，完美～特别是柏阿姨，大晚上还给我们调试温泉水。,0.7422953019110156
天沐温泉度假村,还没去过，看攻略很喜欢，会去体验,0.9612028869053084
天沐温泉度假村,冬天泡温泉非常的舒服，带着家人过来泡温泉，楼上的小丁和小钟服务态度好，赠送水果和茶水，休息大厅安静，舒服，推荐！,0.9358371268860438
天沐温泉度假村,度假村的景色很美，下次还去再去。,0.9657924639785482
天沐温泉度假村,第一次过来泡温泉，听说度假村环境不错，特意过来体验，果然很棒，前台的小苗和小希服务很好，推荐很棒，谢谢，下次还来,0.9996131937453439
天沐温泉度假村,服务非常好，前台赠送了孩子的早餐，客房阿姨孙秀春热情服务，给了酸梅汤，赞,0.9819988088802362
天沐温泉度假村,瘦西湖温泉度假村的风景无敌好看,0.998985758148944
天沐温泉度假村,瘦西湖温泉度假村泡温泉时看美景,0.8503410515526404
天沐温泉度假村,喜欢泡温泉的朋友可以去玩玩！！,0.4983340335557639
